Community,"Christian and Dustin will be coming by your shops today, tomorrow and Friday to let you know about this meeting as well!! \nSee you soon!!"
Action,We are still looking for people to help us out with our Responsible Seafood Secret Shopper... If you head out to eat at any of the RSG restaurants we want to hear about your experience! For more details  please call Christi @ 3289 1213!!
Community,Great idea!
Community,"We would like to firstly thank our 3 new Individual Gold Members, Marco Agurcia, Haller Jackson and the group from Single Divers. The map shows where two of the new dive sites are which are located betweeen West End and West Bay. The first is Haller Deep and is located just east of Blue Channel. The mooring is at 45ft, just at the edge of the wall, with two pinnacles running out into the deep. The other is called Jumpin Jack and is between Tabyannas and Buchos Bank. With huge expanses of sand, the mooring sits at 35ft and is ideal for beginners."
Information,"People have been asking for a list of all the dive sites between Palmetto Bay and Key Hole near West Bay, so here it is with the GPS coordinates and depth of each site"
Community,Thank you to everyone that came out to protect your island!
Community,"We would like to thank our latest Individual Gold Members, Christopher Dye and Dan Szpak. As a dedication to  their dog which sadly passed away, the latest dive site in Sandy Bay is Zack's Patch, located just to the east of Peter's Place. Sitting at 40ft right next to the shallow wall, there are a host of swimthroughs and channels to keep you busy."
Community,Thanks Natelee!
Community,"According to CITES you are not allowed to take more than one shell across an international border. Also, according to the management plan of the National Marine Park you cannot, CANNOT, commercialize, (buy, sell or trade) them.  Most will get confiscated upon entry into the US or Canada. We advise people not to waste their money nor deplete our resource."
Community,The invitation was delivered yesterday... but we will let you know!
Action,Here it is! There is another post on the page as well! Fingers crossed that they will listen! \nhttp://www.thepetitionsite.com/750/652/699/we-need-a-municipal-ordinance-for-a-plastic-free-roatan/
Action,"Are you an avid lionfish hunter? We just got a new batch of lionfish spearing goodies including 3ft spears with either the 3 prong or detachable 6 prong head, mini spears, light and heavy duty elastics, replacement caps and homemade keepers. If you wish to purchase a new spear, please bring your license to the Marine Park store in West End"
Community,"In semana santa our team work hard side by side with Cruz Roja, Bomberos, Police, Marina Mercante, COPECO, Hospitals and Municipality to reduce the risks of semana santa here are some photos of that effort."
Community,The Odyssey on the North Side
Information,"We investigated the boats and please know they had a permit but not one from the Roatan Marine Park...However, the vessel had been issued a permit no. 092-2012, by the Secretaria de Agricultura y Ganaderia that house the Fisheries Department, from the mainland, allowing them to do so, therefore going against the regulations stated in the current and legal management plan."
Community,"Yes, there is BICA!"
Community,Thank you to West Bay Divers... They took the initiative and tackled some of the trash that has been littering out beaches for the last few days. It's all one big bowl of plastic soup... 
Action,"is looking for places to stock the 2010 RMP calendar, we are offering them on concession for businesses who think their customers would want them for Christmas presents, suggestions welcome"
Information,These are babies from a couple years ago. As it was throwback Thursday we wanted to share an awesome photo :)
Community,How has the world changed in your lifetime? Find out here http://www.bbc.com/earth/story/20141016-your-life-on-earth
Community,Thanks to everyone that participated in the cup slogan contest all those months go. \n\nThey have arrived; we have paper cups!\nLps 650/box of 1000 or Lps 65/hundred\nFREE DELIVERY! \n\nDo your part to help Protect Roatan's reef. \n NO MORE PLASTIC in the sea!!!
Information,They have been reported in the sea around the entire island. We believe that the change of wind direction and current that we experienced over the weekend is what brought them to the shore on the West side.
Information,Anything like this would work!
Information,"Our latest Individual Gold Members are Gary and Gwen Randell, owners of Wilson's Blue Lagoon in Dixon Cove. As all the family's name begin with G, they decided to name their dive site ""G spot"" which is located just to the east of Las Palmas in 40ft of water"
Community,"As voted on by the Friends, Members and Supporters of the Roatan Marine Park this Goatee Blenny has won 2nd place in the BEST FIND category! Congratulations @alex harper-brown"
Community,They do claim to be by catch but it makes us wonder when some are so fresh!
